{
    "schema_version":  1,
    "task_id":  "PH22B-RL-013",
    "role":  "research_lead",
    "status":  "COMPLETE",
    "base_commit":  "5b7c4663cd2f7511270299d404204de17bed86d9",
    "result_commit":  "2bf6256cadffa5bc1f0bed556ad7af8095074b35",
    "inputs":  [
                   {
                       "path":  "research/phase22b_spec_v9.json",
                       "sha256":  "78076da1a489309a6b2cdf95c9fb9c68ce94dd675a00c712d746c7f73b681967"
                   },
                   {
                       "path":  "governance/approvals/PH22B-V7-DETERMINISM-AUTH-001.json",
                       "sha256":  "f32b61d98c287b475a3398933af85f890af3652e2247d76ce33d3e603a53b452"
                   }
               ],
    "artifacts":  [
                      {
                          "path":  "research/phase22b_spec_v10.json",
                          "sha256":  "08f67a9cecc4cd593dc8d4fea4772819e8351bfa57cd341b7a82038dc4e87bb1"
                      },
                      {
                          "path":  "docs/PHASE_22B_V10_BOOTSTRAP_IMPLEMENTATION_ADDENDUM.md",
                          "sha256":  "e836dbc64690fae1c1a45f0f0e7074f96024279821304fea81cc6f656dc702fb"
                      },
                      {
                          "path":  "governance/tasks/PH22B-RL-013.json",
                          "sha256":  "e3b96e34ffd565c6db79ecc6056a1020563f3a741844d28e3c45ac2696d3b631"
                      }
                  ],
    "commands":  [
                     "canonical JSON SHA-256 reproduction x2",
                     "v9/v10 protected-field equality assertion",
                     "v6-v9 git immutability check",
                     "task and result schema validation",
                     "git diff --check"
                 ],
    "tests":  [
                  {
                      "name":  "canonical_hash_reproduction_twice",
                      "result":  "PASS"
                  },
                  {
                      "name":  "bootstrap_scientific_contract_unchanged",
                      "result":  "PASS"
                  },
                  {
                      "name":  "compressed_solver_contract_complete",
                      "result":  "PASS"
                  },
                  {
                      "name":  "performance_acceptance_frozen",
                      "result":  "PASS"
                  },
                  {
                      "name":  "data_and_safety_authority_unchanged",
                      "result":  "PASS"
                  }
              ],
    "data_accessed":  [

                      ],
    "prohibitions_verified":  [
                                  "no underlying market data",
                                  "no 2022/2023",
                                  "no 2024+",
                                  "no bootstrap population/draw/seed/count/statistic/covariance/decision change",
                                  "no strategy/PnL/execution/LIVE"
                              ],
    "handoff":  {
                    "to_role":  "statistical_validator_and_qa_reviewer",
                    "requested_decision":  "INDEPENDENT_V10_DETERMINISM_REVIEW",
                    "limitations":  [
                                        "v10 has no implementation or data-access authority until both reviewers approve identical hash"
                                    ]
                },
    "data_windows_accessed":  [

                              ],
    "tests_executed":  [
                           "canonical hash reproduced twice",
                           "protected v9 fields structurally equal except v10 binding and clarification",
                           "compressed/expanded equivalence contract asserted",
                           "performance gate present",
                           "v6-v9 unchanged"
                       ],
    "review_status":  [
                          {
                              "role":  "statistical_validator",
                              "verdict":  "PENDING"
                          },
                          {
                              "role":  "qa_reviewer",
                              "verdict":  "PENDING"
                          }
                      ],
    "end_time":  "2026-09-11T15:13:48.3015114Z",
    "safety_checks":  [
                          {
                              "locked_data_opened":  false
                          },
                          {
                              "live_execution_authorized":  false,
                              "order_submission":  false
                          }
                      ],
    "dataset_hash_used":  "ae0f5b70f686c1b0fff05c0b71f9efb7c3d5da4983eba0df895989dbf6572a91",
    "files_changed":  [
                          "governance/tasks/PH22B-RL-013.json",
                          "research/phase22b_spec_v10.json",
                          "docs/PHASE_22B_V10_BOOTSTRAP_IMPLEMENTATION_ADDENDUM.md",
                          "governance/results/PH22B-RL-013.json"
                      ],
    "test_results":  [
                         {
                             "scope":  "v10 no-data deterministic clarification",
                             "passed":  5,
                             "failed":  0
                         }
                     ],
    "artifact_hashes":  {
                            "specification":  "08f67a9cecc4cd593dc8d4fea4772819e8351bfa57cd341b7a82038dc4e87bb1",
                            "addendum":  "e836dbc64690fae1c1a45f0f0e7074f96024279821304fea81cc6f656dc702fb",
                            "task_manifest":  "e3b96e34ffd565c6db79ecc6056a1020563f3a741844d28e3c45ac2696d3b631"
                        },
    "terminal_result":  "PH22B_SPEC_V10_FROZEN_PENDING_INDEPENDENT_REVIEW",
    "start_time":  "2026-09-11T15:13:48.3015114Z",
    "specification_hash_used":  "08f67a9cecc4cd593dc8d4fea4772819e8351bfa57cd341b7a82038dc4e87bb1"
}
