{
  "schema_version": 1,
  "task_id": "PH22B-REVIEW-019",
  "role": "qa_reviewer",
  "status": "COMPLETE",
  "base_commit": "e548dd244812a689b49666e98e56e2b27facddd7",
  "result_commit": "66eed97ee481f51ff9ef7f0c4521502fedd0b9d9",
  "inputs": [{"path": "research/phase22b_spec_v12.json", "sha256": "12eb328ccc433a4dd75128fafdfb56fe293e30c96bc0962510554b218621610f"}, {"path": "governance/tasks/PH22B-RI-002.json", "sha256": "7d1ddcbfc6b91769cb60f9d4ff95757b0355d2c7171adad5ba30be358b355e85"}, {"path": "governance/evidence/PH22B_V12_EXACT_BENCHMARK.json", "sha256": "7bf5c078912545645132d88ab73bf17068d8633f07acc242f56121fc3ca504c5"}],
  "artifacts": [{"path": "governance/tasks/PH22B-REVIEW-019.json", "sha256": "07e2e6e8a96380ec0da8f44df120c9aa2686da9a4f97de607b03ae7df09a8b10"}, {"path": "governance/reviews/PH22B-REVIEW-019-QA.json", "sha256": "441bfda1e0889baf5990176b3421240496cfd7ed926230893cfbee0f385fcd6e"}],
  "commands": ["checked-in Phase 22B control plane", "focused synthetic/metadata-only pytest suite", "complete repository pytest suite", "canonical hash reproduction", "schema and clean-state checks"],
  "tests": [{"name": "checked_in_control_plane", "result": "PASS_NO_DATA"}, {"name": "focused_suite", "passed": 151, "failed": 0}, {"name": "complete_repository_suite", "passed": 603, "failed": 0, "warnings": 13}],
  "data_accessed": [],
  "prohibitions_verified": ["no locator or market data", "no 2022+", "no implementation/specification modification", "no strategy/PnL/execution/LIVE"],
  "handoff": {"to_role": "project_orchestrator", "requested_decision": "ACCEPT_PHASE22B_PRE_DATA_IMPLEMENTATION_QA_APPROVAL", "limitations": ["Approval is pre-data only and does not itself unlock data, advance phase, or authorize strategy, PnL, execution, or LIVE."]},
  "data_windows_accessed": [],
  "tests_executed": ["151 focused Phase 22B/governance tests", "603 complete repository tests", "real checked-in no-data control plane", "benchmark/spec canonical hashes", "task/result schema validation", "git diff check and cleanliness"],
  "review_status": [{"role": "qa_reviewer", "verdict": "APPROVED", "blocking_findings": 0}],
  "end_time": "2026-09-12T08:30:00Z",
  "safety_checks": [{"market_data_accessed": false, "locator_targets_opened": false}, {"locked_or_forbidden_data_accessed": false}, {"live_execution_authorized": false, "order_submission": false}],
  "dataset_hash_used": "ae0f5b70f686c1b0fff05c0b71f9efb7c3d5da4983eba0df895989dbf6572a91",
  "files_changed": ["governance/tasks/PH22B-REVIEW-019.json", "governance/reviews/PH22B-REVIEW-019-QA.json", "governance/results/PH22B-REVIEW-019.json"],
  "test_results": [{"scope": "focused", "passed": 151, "failed": 0}, {"scope": "complete repository", "passed": 603, "failed": 0, "warnings": 13}],
  "artifact_hashes": {"governance/tasks/PH22B-REVIEW-019.json": "07e2e6e8a96380ec0da8f44df120c9aa2686da9a4f97de607b03ae7df09a8b10", "governance/reviews/PH22B-REVIEW-019-QA.json": "441bfda1e0889baf5990176b3421240496cfd7ed926230893cfbee0f385fcd6e"},
  "terminal_result": "APPROVED_FOR_IMPLEMENTATION_INDEPENDENT_REVIEW_GATE",
  "start_time": "2026-09-12T08:10:00Z",
  "specification_hash_used": "12eb328ccc433a4dd75128fafdfb56fe293e30c96bc0962510554b218621610f"
}
