{
    "schema_version":  1,
    "task_id":  "PH22B-GOV-009",
    "role":  "project_orchestrator",
    "start_time":  "2026-09-10T20:58:21Z",
    "end_time":  "2026-09-10T20:58:21Z",
    "status":  "COMPLETE",
    "base_commit":  "8cd1881d31f7899cb138576a90a1122b7783c07e",
    "result_commit":  "a9976c47c3886e1817574b0127d449d59ab8edc7",
    "files_changed":  [
                          "governance/tasks/PH22B-GOV-009.json",
                          "governance/tasks/PH22B-REVIEW-009.json"
                      ],
    "artifacts":  [

                  ],
    "artifact_hashes":  {

                        },
    "tests_executed":  [
                           "documented exact Phase 22B no-data command"
                       ],
    "test_results":  [
                         {
                             "status":  "PASSED",
                             "name":  "exact_phase22b_no_data_suite",
                             "count":  48
                         }
                     ],
    "data_windows_accessed":  [

                              ],
    "specification_hash_used":  "343b6918acb62a68065eb16ecfc7fd05704fe8a77695d8417f7f81062475d56d",
    "dataset_hash_used":  "ae0f5b70f686c1b0fff05c0b71f9efb7c3d5da4983eba0df895989dbf6572a91",
    "safety_checks":  [
                          {
                              "name":  "v6_unchanged",
                              "status":  "PASSED"
                          },
                          {
                              "name":  "no_data",
                              "status":  "PASSED"
                          }
                      ],
    "review_status":  [
                          {
                              "decision":  "PENDING",
                              "role":  "qa_reviewer"
                          }
                      ],
    "terminal_result":  "V6_EXACT_PROVENANCE_REMEDIATED_PENDING_REVIEW_009",
    "inputs":  [

               ],
    "commands":  [

                 ],
    "tests":  [

              ],
    "data_accessed":  [

                      ],
    "prohibitions_verified":  [
                                  "no v6 mutation",
                                  "no data",
                                  "no LIVE"
                              ],
    "handoff":  {
                    "requested_decision":  "PH22B-REVIEW-009 then independent QA",
                    "limitations":  [
                                        "V6 unchanged.",
                                        "No implementation authorized."
                                    ],
                    "to_role":  "statistical_validator"
                }
}
