{
  "schema_version": 1,
  "task_id": "PH22B-REVIEW-010",
  "role": "statistical_validator",
  "status": "COMPLETE",
  "base_commit": "b754cd7a3b8d705fa83c2c55c261a3ca2ce512e6",
  "result_commit": null,
  "inputs": [
    {
      "path": "research/phase22b_spec_v12.json",
      "sha256": "12eb328ccc433a4dd75128fafdfb56fe293e30c96bc0962510554b218621610f"
    },
    {
      "path": "governance/results/PH22B-RL-015.json",
      "sha256": "c654e0358e534d70ce7d9d63883f50e3f381731b051a254fa83c0ce0facea2f6"
    }
  ],
  "artifacts": [
    {
      "path": "governance/reviews/PH22B-V12-STAT-REVIEW-001.json",
      "sha256": "47ecb5191048aad25a7f4978ba20fc1e6a533adc8b6dc3aaf026b368cfbbd91d"
    }
  ],
  "commands": [
    "canonical JSON SHA-256 reproduction twice",
    "v11/v12 structural protected-contract comparison",
    "v6-v11 immutable git diff verification",
    "independent mathematical review of v12 numerical and bootstrap contracts",
    "JSON and RESULT_MANIFEST schema validation",
    "git diff --check"
  ],
  "tests": [
    {"name": "canonical_hash_reproduction", "result": "PASS"},
    {"name": "prior_spec_immutability", "result": "PASS"},
    {"name": "role_specific_v12_math_review", "result": "PASS"},
    {"name": "result_schema_validation", "result": "PASS"},
    {"name": "no_data_governance", "result": "PASS"}
  ],
  "data_accessed": [],
  "prohibitions_verified": [
    "no market data",
    "no 2022 or 2023",
    "no 2024+",
    "no specification or code mutation",
    "no strategy, PnL, execution or LIVE"
  ],
  "handoff": {
    "to_role": "project_orchestrator_and_qa_reviewer",
    "requested_decision": "ACCEPT_PHASE22B_V12_STATISTICAL_APPROVAL",
    "limitations": [
      "statistical approval does not advance the phase or unlock data",
      "independent QA approval remains required"
    ]
  },
  "data_windows_accessed": [],
  "tests_executed": [
    "canonical hash reproduction",
    "prior-spec immutability",
    "v12 numerical-contract review",
    "result schema validation",
    "no-data governance checks"
  ],
  "review_status": [
    {"role": "statistical_validator", "verdict": "APPROVED"},
    {"role": "qa_reviewer", "verdict": "PENDING"}
  ],
  "end_time": "2026-09-11T15:30:00Z",
  "safety_checks": [
    {"market_data_accessed": false},
    {"live_execution_authorized": false, "order_submission": false}
  ],
  "dataset_hash_used": "ae0f5b70f686c1b0fff05c0b71f9efb7c3d5da4983eba0df895989dbf6572a91",
  "files_changed": [
    "governance/reviews/PH22B-V12-STAT-REVIEW-001.json",
    "governance/results/PH22B-REVIEW-010.json"
  ],
  "test_results": [
    {"scope": "v12 independent no-data statistical review", "passed": 5, "failed": 0}
  ],
  "artifact_hashes": {
    "statistical_review": "47ecb5191048aad25a7f4978ba20fc1e6a533adc8b6dc3aaf026b368cfbbd91d"
  },
  "terminal_result": "PH22B_V12_STATISTICAL_REVIEW_APPROVED",
  "start_time": "2026-09-11T15:30:00Z",
  "specification_hash_used": "12eb328ccc433a4dd75128fafdfb56fe293e30c96bc0962510554b218621610f"
}
