{
    "schema_version":  1,
    "task_id":  "PH22B-RL-014",
    "role":  "research_lead",
    "status":  "COMPLETE",
    "base_commit":  "583f8db127f3584236a7636e6dfc7348d916ec14",
    "result_commit":  "9e66ed52160f7829ba2c21d09b9b871ee1ceaa97",
    "inputs":  [
                   {
                       "path":  "research/phase22b_spec_v10.json",
                       "sha256":  "08f67a9cecc4cd593dc8d4fea4772819e8351bfa57cd341b7a82038dc4e87bb1"
                   },
                   {
                       "path":  "governance/approvals/PH22B-V7-DETERMINISM-AUTH-001.json",
                       "sha256":  "f32b61d98c287b475a3398933af85f890af3652e2247d76ce33d3e603a53b452"
                   },
                   {
                       "path":  "governance/approvals/PH22B-SCORE-DIAGNOSTIC-AUTH-001.json",
                       "sha256":  "f9893bacdbe3dc21f811c864380f0c5421eb46f59e7cf56538ab7da7d69c284c"
                   }
               ],
    "artifacts":  [
                      {
                          "path":  "research/phase22b_spec_v11.json",
                          "sha256":  "73b5251d046836aebbcb5798b9048a2bc7668c4d017e676aaa1a33f1924c6701"
                      },
                      {
                          "path":  "docs/PHASE_22B_V11_NUMERICAL_EQUIVALENCE_ADDENDUM.md",
                          "sha256":  "fba4c00ddb8c68b653935b076fa26fdf9a453954d8de90361a94b010e7bd574d"
                      },
                      {
                          "path":  "governance/tasks/PH22B-RL-014.json",
                          "sha256":  "a580abd4d6595abc870869ba0239b7afb7a0b4bb5a35d8ca3bde9e2325aa94a9"
                      }
                  ],
    "commands":  [
                     "canonical hash reproduction x2",
                     "v10/v11 protected equality",
                     "v6-v10 immutability",
                     "schema validation",
                     "diff check"
                 ],
    "tests":  [
                  {
                      "name":  "canonical_hash_twice",
                      "result":  "PASS"
                  },
                  {
                      "name":  "condition_aware_contract",
                      "result":  "PASS"
                  },
                  {
                      "name":  "deterministic_qr_fallback",
                      "result":  "PASS"
                  },
                  {
                      "name":  "all_task_inputs_handed_off",
                      "result":  "PASS"
                  },
                  {
                      "name":  "authority_unchanged",
                      "result":  "PASS"
                  }
              ],
    "data_accessed":  [

                      ],
    "prohibitions_verified":  [
                                  "no market data",
                                  "no 2022/2023",
                                  "no 2024+",
                                  "no bootstrap/scientific decision change",
                                  "no strategy/PnL/execution/LIVE"
                              ],
    "handoff":  {
                    "to_role":  "statistical_validator_and_qa_reviewer",
                    "requested_decision":  "INDEPENDENT_V11_DETERMINISM_REVIEW",
                    "limitations":  [
                                        "no implementation/data authority before identical-hash approvals"
                                    ]
                },
    "data_windows_accessed":  [

                              ],
    "tests_executed":  [
                           "canonical hash twice",
                           "protected equality",
                           "prior immutability",
                           "input completeness",
                           "result schema"
                       ],
    "review_status":  [
                          {
                              "role":  "statistical_validator",
                              "verdict":  "PENDING"
                          },
                          {
                              "role":  "qa_reviewer",
                              "verdict":  "PENDING"
                          }
                      ],
    "end_time":  "2026-09-11T15:19:03.9236303Z",
    "safety_checks":  [
                          {
                              "locked_data_opened":  false
                          },
                          {
                              "live_execution_authorized":  false,
                              "order_submission":  false
                          }
                      ],
    "dataset_hash_used":  "ae0f5b70f686c1b0fff05c0b71f9efb7c3d5da4983eba0df895989dbf6572a91",
    "files_changed":  [
                          "governance/tasks/PH22B-RL-014.json",
                          "research/phase22b_spec_v11.json",
                          "docs/PHASE_22B_V11_NUMERICAL_EQUIVALENCE_ADDENDUM.md",
                          "governance/results/PH22B-RL-014.json"
                      ],
    "test_results":  [
                         {
                             "scope":  "v11 no-data numerical clarification",
                             "passed":  5,
                             "failed":  0
                         }
                     ],
    "artifact_hashes":  {
                            "specification":  "73b5251d046836aebbcb5798b9048a2bc7668c4d017e676aaa1a33f1924c6701",
                            "addendum":  "fba4c00ddb8c68b653935b076fa26fdf9a453954d8de90361a94b010e7bd574d",
                            "task_manifest":  "a580abd4d6595abc870869ba0239b7afb7a0b4bb5a35d8ca3bde9e2325aa94a9"
                        },
    "terminal_result":  "PH22B_SPEC_V11_FROZEN_PENDING_INDEPENDENT_REVIEW",
    "start_time":  "2026-09-11T15:19:03.9236303Z",
    "specification_hash_used":  "73b5251d046836aebbcb5798b9048a2bc7668c4d017e676aaa1a33f1924c6701"
}
