{
    "schema_version":  1,
    "task_id":  "PH22B-ORCH-002",
    "role":  "project_orchestrator",
    "status":  "COMPLETE",
    "base_commit":  "a9414cd24bbfd2fd4d48d3735123a58b2e4dac56",
    "result_commit":  "5582948b68277d8905a2c64aa36f111b9f903a80",
    "inputs":  [
                   {
                       "sha256":  "8693daa1b91898cf2b42aa218d52137cbcf7caee40bafa6f09dca07c633c1bb3",
                       "path":  "governance/reviews/PH22B-RUNTIME-002-QA.json"
                   },
                   {
                       "sha256":  "3b0209cca0e45e1add35b2c6b9505fb806921c296fa3c2b5ab6a921230974d8b",
                       "path":  "governance/results/PH22B-REVIEW-027.json"
                   }
               ],
    "artifacts":  [
                      {
                          "sha256":  "a5a0abcd99de5075500ba583d274c191b2ba5c181c91e1029717c3497329e521",
                          "path":  "governance/evidence/PH22B-RUNTIME-002-ORCHESTRATOR-ACCEPTANCE.json"
                      }
                  ],
    "commands":  [
                     "verify QA lineage, hashes, authority and schemas"
                 ],
    "tests":  [
                  {
                      "name":  "integrated_state_and_schemas",
                      "passed":  true
                  }
              ],
    "data_accessed":  [

                      ],
    "prohibitions_verified":  [
                                  "no market data during acceptance",
                                  "v12 and authority unchanged",
                                  "no strategy/PnL/execution/LIVE"
                              ],
    "handoff":  {
                    "requested_decision":  "CREATE_AND_LAUNCH_NEW_DURABLE_PHASE22B_V12_RUN",
                    "limitations":  [
                                        "fresh run ID required",
                                        "2019-2021 only"
                                    ],
                    "to_role":  "project_orchestrator"
                },
    "data_windows_accessed":  [

                              ],
    "tests_executed":  [
                           "focused governance/runtime preflight"
                       ],
    "review_status":  [
                          {
                              "verdict":  "QA_APPROVED",
                              "blocking_findings":  0,
                              "role":  "qa_reviewer"
                          },
                          {
                              "verdict":  "ACCEPTED",
                              "role":  "project_orchestrator"
                          }
                      ],
    "end_time":  "2026-09-13T17:26:04.1328344Z",
    "safety_checks":  [
                          {
                              "name":  "authority_preservation",
                              "status":  "PASSED"
                          }
                      ],
    "dataset_hash_used":  "ae0f5b70f686c1b0fff05c0b71f9efb7c3d5da4983eba0df895989dbf6572a91",
    "files_changed":  [
                          "governance/tasks/PH22B-RUNTIME-002.json",
                          "governance/results/PH22B-ORCH-002.json",
                          "tests/orchestration/test_integrated_state.py"
                      ],
    "test_results":  [
                         {
                             "scope":  "acceptance",
                             "failed":  0,
                             "passed":  1
                         }
                     ],
    "artifact_hashes":  {
                            "governance/evidence/PH22B-RUNTIME-002-ORCHESTRATOR-ACCEPTANCE.json":  "a5a0abcd99de5075500ba583d274c191b2ba5c181c91e1029717c3497329e521"
                        },
    "terminal_result":  "IDENTITY_REMEDIATION_ACCEPTED_READY_FOR_FRESH_DURABLE_RUN",
    "start_time":  "2026-09-13T17:26:04.1328344Z",
    "specification_hash_used":  "12eb328ccc433a4dd75128fafdfb56fe293e30c96bc0962510554b218621610f"
}
